{
  "name": "Naval Station Norfolk",
  "country": "United States",
  "operator": "United States Navy",
  "location": {
    "lat": 36.946,
    "lon": -76.313
  },
  "nearest_city": "Norfolk",
  "max_ship_length_m": 337,
  "max_ship_beam_m": 78,
  "max_draught_m": 12,
  "pier_depth_m": 14,
  "dry_dock_length_m": null,
  "carrier_capable": "yes",
  "homeport_for_carriers": true,
  "notes": "Largest U.S. Navy base and a principal aircraft carrier homeport.",
  "wikipedia_url": "https://en.wikipedia.org/wiki/Naval_Station_Norfolk"
}
